{
  "taxa": [],
  "number_of_models": 50,
  "number_of_models_in_error": 31,
  "number_of_correct_models": 19,
  "messages": {
    "gorule-0000019": [
      {
        "level": "ERROR",
        "model-id": "gomodel:5d27d1cf00000154",
        "type": "Violates GO Rule",
        "obj": "",
        "taxa": [],
        "message": "GORULE:0000019: Model is logically inconsistent",
        "rule": 19
      },
      {
        "level": "ERROR",
        "model-id": "gomodel:5d27d1cf00000311",
        "type": "Violates GO Rule",
        "obj": "",
        "taxa": [],
        "message": "GORULE:0000019: Model is logically inconsistent",
        "rule": 19
      },
      {
        "level": "ERROR",
        "model-id": "gomodel:5d27d1cf00000368",
        "type": "Violates GO Rule",
        "obj": "",
        "taxa": [],
        "message": "GORULE:0000019: Model is logically inconsistent",
        "rule": 19
      },
      {
        "level": "ERROR",
        "model-id": "gomodel:5d27d1cf00000173",
        "type": "Violates GO Rule",
        "obj": "",
        "taxa": [],
        "message": "GORULE:0000019: Model is logically inconsistent",
        "rule": 19
      },
      {
        "level": "ERROR",
        "model-id": "gomodel:59dc728000000512",
        "type": "Violates GO Rule",
        "obj": "",
        "taxa": [],
        "message": "GORULE:0000019: Model is logically inconsistent",
        "rule": 19
      },
      {
        "level": "ERROR",
        "model-id": "gomodel:5d27d1cf00000250",
        "type": "Violates GO Rule",
        "obj": "",
        "taxa": [],
        "message": "GORULE:0000019: Model is logically inconsistent",
        "rule": 19
      },
      {
        "level": "ERROR",
        "model-id": "gomodel:5b528b1100000186",
        "type": "Violates GO Rule",
        "obj": "",
        "taxa": [],
        "message": "GORULE:0000019: Model is logically inconsistent",
        "rule": 19
      },
      {
        "level": "ERROR",
        "model-id": "gomodel:5d27d1cf00000484",
        "type": "Violates GO Rule",
        "obj": "",
        "taxa": [],
        "message": "GORULE:0000019: Model is logically inconsistent",
        "rule": 19
      },
      {
        "level": "ERROR",
        "model-id": "gomodel:5d27d1cf00000078",
        "type": "Violates GO Rule",
        "obj": "",
        "taxa": [],
        "message": "GORULE:0000019: Model is logically inconsistent",
        "rule": 19
      },
      {
        "level": "ERROR",
        "model-id": "gomodel:5d27d1cf00000330",
        "type": "Violates GO Rule",
        "obj": "",
        "taxa": [],
        "message": "GORULE:0000019: Model is logically inconsistent",
        "rule": 19
      },
      {
        "level": "ERROR",
        "model-id": "gomodel:5d27d1cf00000231",
        "type": "Violates GO Rule",
        "obj": "",
        "taxa": [],
        "message": "GORULE:0000019: Model is logically inconsistent",
        "rule": 19
      },
      {
        "level": "ERROR",
        "model-id": "gomodel:5d27d1cf00000387",
        "type": "Violates GO Rule",
        "obj": "",
        "taxa": [],
        "message": "GORULE:0000019: Model is logically inconsistent",
        "rule": 19
      },
      {
        "level": "ERROR",
        "model-id": "gomodel:5d27d1cf00000135",
        "type": "Violates GO Rule",
        "obj": "",
        "taxa": [],
        "message": "GORULE:0000019: Model is logically inconsistent",
        "rule": 19
      },
      {
        "level": "ERROR",
        "model-id": "gomodel:5d27d1cf00000116",
        "type": "Violates GO Rule",
        "obj": "",
        "taxa": [],
        "message": "GORULE:0000019: Model is logically inconsistent",
        "rule": 19
      },
      {
        "level": "ERROR",
        "model-id": "gomodel:59dc728000000513",
        "type": "Violates GO Rule",
        "obj": "",
        "taxa": [],
        "message": "GORULE:0000019: Model is logically inconsistent",
        "rule": 19
      },
      {
        "level": "ERROR",
        "model-id": "gomodel:5d27d1cf00000464",
        "type": "Violates GO Rule",
        "obj": "",
        "taxa": [],
        "message": "GORULE:0000019: Model is logically inconsistent",
        "rule": 19
      }
    ],
    "gorule-0000056": [
      {
        "level": "WARNING",
        "model-id": "gomodel:5d27d1cf00000135",
        "type": "Violates GO Rule",
        "obj": "",
        "taxa": [],
        "message": "GORULE:0000056: Model does not validate against shex schema",
        "rule": 56,
        "explanations": {
          "is-conformant": false,
          "owl-validation": {
            "id": "OWL_REASONER",
            "is-conformant": false,
            "tracker": "https://github.com/geneontology/helpdesk/issues",
            "rule-file": "https://github.com/geneontology/go-ontology",
            "violations": [
              {
                "node": "id of inconsistent node"
              }
            ]
          },
          "shex-validation": {
            "node-matched-shapes": {},
            "is-conformant": false,
            "tracker": "https://github.com/geneontology/go-shapes/issues",
            "rule-file": "https://github.com/geneontology/go-shapes/blob/master/shapes/go-cam-shapes.shex",
            "violations": [
              {
                "explanations": [
                  {
                    "shape": "obo:go/shapes/MolecularFunction",
                    "constraints": [
                      {
                        "object": "gomodel:5d27d1cf00000135/5d27d1cf00000153",
                        "property": "BFO:0000066",
                        "node_types": [
                          "GO:0009008"
                        ],
                        "object_types": [
                          "GO:0006261"
                        ],
                        "nobjects": 0,
                        "matched_range_shapes": [
                          "obo:go/shapes/ProvenanceAnnotated",
                          "obo:go/shapes/BiologicalProcess",
                          "obo:go/shapes/GoCamEntity"
                        ],
                        "intended-range-shapes": [
                          "obo:go/shapes/AnatomicalEntity"
                        ]
                      }
                    ]
                  }
                ],
                "node": "gomodel:5d27d1cf00000135/5d27d1cf00000143"
              }
            ]
          }
        }
      },
      {
        "level": "WARNING",
        "model-id": "gomodel:5d27d1cf00000311",
        "type": "Violates GO Rule",
        "obj": "",
        "taxa": [],
        "message": "GORULE:0000056: Model does not validate against shex schema",
        "rule": 56,
        "explanations": {
          "is-conformant": false,
          "owl-validation": {
            "id": "OWL_REASONER",
            "is-conformant": false,
            "tracker": "https://github.com/geneontology/helpdesk/issues",
            "rule-file": "https://github.com/geneontology/go-ontology",
            "violations": [
              {
                "node": "id of inconsistent node"
              }
            ]
          },
          "shex-validation": {
            "node-matched-shapes": {},
            "is-conformant": false,
            "tracker": "https://github.com/geneontology/go-shapes/issues",
            "rule-file": "https://github.com/geneontology/go-shapes/blob/master/shapes/go-cam-shapes.shex",
            "violations": [
              {
                "explanations": [
                  {
                    "shape": "obo:go/shapes/MolecularFunction",
                    "constraints": [
                      {
                        "object": "gomodel:5d27d1cf00000311/5d27d1cf00000321",
                        "property": "RO:0002234",
                        "node_types": [
                          "GO:0009008"
                        ],
                        "object_types": [
                          "CHEBI:75962"
                        ],
                        "nobjects": 0,
                        "matched_range_shapes": [
                          "obo:go/shapes/ProvenanceAnnotated",
                          "obo:go/shapes/GoCamEntity"
                        ],
                        "intended-range-shapes": [
                          "obo:go/shapes/ChemicalEntity",
                          "obo:go/shapes/ProteinContainingComplex"
                        ]
                      },
                      {
                        "object": "gomodel:5d27d1cf00000311/5d27d1cf00000329",
                        "property": "RO:0002233",
                        "node_types": [
                          "GO:0009008"
                        ],
                        "object_types": [
                          "GO:0006260"
                        ],
                        "nobjects": 0,
                        "matched_range_shapes": [
                          "obo:go/shapes/ProvenanceAnnotated",
                          "obo:go/shapes/BiologicalProcess",
                          "obo:go/shapes/GoCamEntity"
                        ],
                        "intended-range-shapes": [
                          "obo:go/shapes/ChemicalEntity",
                          "obo:go/shapes/ProteinContainingComplex"
                        ]
                      }
                    ]
                  }
                ],
                "node": "gomodel:5d27d1cf00000311/5d27d1cf00000319"
              }
            ]
          }
        }
      },
      {
        "level": "WARNING",
        "model-id": "gomodel:59dc728000000512",
        "type": "Violates GO Rule",
        "obj": "",
        "taxa": [],
        "message": "GORULE:0000056: Model does not validate against shex schema",
        "rule": 56,
        "explanations": {
          "is-conformant": false,
          "owl-validation": {
            "id": "OWL_REASONER",
            "is-conformant": false,